### ISSUE TITLE
Add support for HTTP2 Trailer support

### ISSUE THREAD

**Issue by ghaskins** [pedestal/pedestal#564]
# Description

I discovered while trying to support [GRPCs](https://grpc.io/) natively in Clojure using Pedestal that is doesn't appear to be possible to support HTTP2 Trailing metadata in the current code.  This feature is required to generate [conforming GRPC responses](https://github.com/grpc/grpc/blob/master/doc/PROTOCOL-HTTP2.md#responses).

Note that Servlet 4.0 supposedly adds support for HttpServletResponse.setTrailingFields() which I _think_ provide the base substrate.  We would then need something like a :trailer collection added to the :response map to wire into this.

## Possible Workarounds

Implement a custom ServletInterceptor to include Servlet 4.0 features.

**Comment by ohpauleez** [comment]
Thanks for reaching out!

I was actually just looking at the Servlet 4.0 spec today to figure out when we should make the jump.

I'm not sure what Java HTTP2 implementations support the Trailer header after a chunked response, but if you find one (check Jetty and Undertow) you may consider writing your own Chain Provider as a workaround.  To do this, you'd follow the general approach in the `fast-pedestal` sample, making a custom provider to run an interceptor chain exactly how you want.

Once the Servlet 4.0 support lands, I think it provides the capabilities you're after.

**Comment by ghaskins** [comment]
@ohpauleez sounds like a plan, thanks.  Let me know if I can help with the official support

**Comment by ghaskins** [comment]
I was able to build a POC for the trailer function using Undertow v2.0.7-Final:

```
(ns undertow-test.core
  (:require [clojure.pprint :refer [pprint]])
  (:import [io.undertow.server
            HttpHandler
            HttpServerExchange]
           [io.undertow
            Undertow
            UndertowOptions]
           [io.undertow.server.protocol.http
            HttpAttachments]
           [io.undertow.util
            HeaderMap
            HttpString])
  (:gen-class))

(defn ->Headers
  [coll]
  (let [headers (HeaderMap.)]
    (doseq [[k v] coll]
      (.add headers (HttpString. k) v))
    headers))

(defn request [exchange]
  (let [trailers (->Headers [["grpc-status" "0"]
                             ["trace-proto-bin" "asdasd"]])]
    (.putAttachment exchange HttpAttachments/RESPONSE_TRAILERS trailers)
    (.. exchange (getResponseSender) (send "Hello"))))

(def handler
  (proxy
    [HttpHandler] []
    (handleRequest
      [^HttpServerExchange exchange]
      (request exchange))))

(defn start []
  (let [server (.. Undertow
                   (builder)
                   (addHttpListener 8080, "localhost")
                   (setServerOption UndertowOptions/ENABLE_HTTP2 true)
                   (setHandler handler)
                   (build))]
    (.start server)
    server))

(defn stop [server]
  (.stop server))

(defn -main
  [& args]
  (let [server (start)]
    (stop server)))
```

This created a trailer in the stream that appears to be conforming with the GRPC spec, at least when observing a wireshark capture:

```
Frame 21: 150 bytes on wire (1200 bits), 150 bytes captured (1200 bits) on interface 0
Null/Loopback
Internet Protocol Version 4, Src: 127.0.0.1, Dst: 127.0.0.1
Transmission Control Protocol, Src Port: 8080, Dst Port: 51423, Seq: 136, Ack: 248, Len: 94
HyperText Transfer Protocol 2
    Stream: HEADERS, Stream ID: 1, Length 30
        Length: 30
        Type: HEADERS (1)
        Flags: 0x04
            .... ...0 = End Stream: False
            .... .1.. = End Headers: True
            .... 0... = Padded: False
            ..0. .... = Priority: False
            00.0 ..0. = Unused: 0x00
        0... .... .... .... .... .... .... .... = Reserved: 0x0
        .000 0000 0000 0000 0000 0000 0000 0001 = Stream Identifier: 1
        [Pad Length: 0]
        Header Block Fragment: 881f0d01351f1296c361be94136a681fa50400bca0037197...
        [Header Length: 82]
        [Header Count: 3]
        Header: :status: 200
        Header: content-length: 5
        Header: date: Fri, 25 May 2018 01:36:29 GMT
        Padding: <MISSING>
    Stream: DATA, Stream ID: 1, Length 5
        Length: 5
        Type: DATA (0)
        Flags: 0x00
        0... .... .... .... .... .... .... .... = Reserved: 0x0
        .000 0000 0000 0000 0000 0000 0000 0001 = Stream Identifier: 1
        [Pad Length: 0]
        Data: 48656c6c6f
        Padding: <MISSING>
    Stream: HEADERS, Stream ID: 1, Length 32
        Length: 32
        Type: HEADERS (1)
        Flags: 0x05
            .... ...1 = End Stream: True
            .... .1.. = End Headers: True
            .... 0... = Padded: False
            ..0. .... = Priority: False
            00.0 ..0. = Unused: 0x00
        0... .... .... .... .... .... .... .... = Reserved: 0x0
        .000 0000 0000 0000 0000 0000 0000 0001 = Stream Identifier: 1
        [Pad Length: 0]
        Header Block Fragment: 408b4d832156aec3a4eb466abf0661736461736440889aca...
        [Header Length: 49]
        [Header Count: 2]
        Header: trace-proto-bin: asdasd
        Header: grpc-status: 0
        Padding: <MISSING>
```

I chose to go directly to undertow because Immutant is still lagging on Undertow v1.4.

**Comment by ohpauleez** [comment]
Excellent!  This article also illustrates how to use request and response trailers in Jetty - https://webtide.com/http-trailers-in-jetty/

I can help shape your example into something that runs an Interceptor chain.

**Comment by hlship** [comment]
This looks like something we can address in the future with Jetty 10 or 11 support.
